Comments,HateSpeech
এটা কেমন বাংলাদেশ নিজের স্বাধীনতা বলতে কিছুই নেই,0
মনডা চায় পুলিশের পাছায় গরম সিদ্ধ ডিম ঢুকায় দেই।,1
পুলিশ না জানোয়ার এইগুলা,1
কুতার বাচ্চা পুলিশ তোদের কে ঘৃনা করি,1
সৈরাচার খুনি নিপাত যাক গনতন্ত্র মুক্তি পাক!,1
অমানুষ গুলো এগুলোর বিচার আল্লাহ যেনো হারে হারে করে,1
স্বৈরাচার নিপাত যাক গণতন্ত্র মুক্তি পাক,1
খুনি পদত্যাগ চাই!,1
আমার ভাইয়ের রক্ত নিয়ে এখন রক্তদান কর্মসূচি পালন করছে।হাস্যকর!,0
আপার উন্নয়নের জোরেই বাংলাদেশ হোগামারা খাইতাছে.,1
"খুনি, রক্ত চোসা",1
বুঝা যায় এই দেশের বিচারপতিদের বিচি নাই।,1
চেহেরা যেনো ফেরাউনের প্রতিচ্ছবি,1
আগে তোমার পতন ঠেকাও পরে না হয় নিষিদ্ধ করিও,1
"তুর প্রজ্ঞাপন তুর পুটকির ভিতর দিয়ে দিমু, মাগীর পুত",1
নোটির ছেলে,1
পদত্যাগ না করা পর্যন্ত দেশে কখনো শান্তির আশা করা যাবে না,0
বাস্টার্ড তোদের নিষিদ্ধ করা হোক।,1
খানকির পোলায় কয় কিহ,1
রাস্তা থেকে জন্ম নেয়া আরেক মাগী সুদা,1
খানকির পোলায় এতদিন কই ছিলো,1
কুত্তার বাচ্চা সাদ্দাম হোসেন,1
এরা কি জামাত শিবির কুত্তার বাচ্চা কি কয়,1
হালায় পাক্কা যৌনকর্মীর পোলা,1
নটীর ছেলে,1
নডির পোলা সাদ্দাম মারে বাপ,1
দুরু খানকির ছেলে,1
তর গলাডা এক কুবে হালায় দিতে পারতাম,1
সোদানির পোলা,1
আরে জানোয়ারের বাচ্চা এই সবগুলা হচ্ছে কনডম দুর্ঘটনার ফসল,1
একে এখনো ছাত্ররা গণপিটুনি দেয় না কেন,0
এতো আসলেই খানকির ছেলে,1
ইতে আরেক চুদানির পোয়া,1
আদু ভাই তুই করবি বুইড়ালীগ।,0
কুত্তার বাচ্চা তুই সালা,1
খানকির ছেলে,1
কুত্তা মার্কা কনডম লীগ বলে কি?,1
খানকির পোলা,1
কুত্তার বাচ্চা প্রশ্ন যে পাশ কিছু কআবালের বাচ্চা আবাল সাংবাদিক,1
কুত্তার বাচ্চারে সাংবাদিক বলতেও লজ্জা করে,1
পতিতালয়ে কনডম দুর্ঘটনায় যে ছেলেটি হইছিল বড় হয়ে সে এই সাংবাদিক হইছে,1
৩০ লক্ষ শহিদেরা কী তা হলে বসে বসে আঙুল চুষবে.,0
এতো খেললে ঘুমাবে কখন ,0
এটা দেওয়া উচিত ছিলো একে লজ্জার ভ্যাকসিন দেওয়া হোক পিও আহারে লাং নাই আর কান্দি ও না,0
এইসব ভিডিও করিস লজ্জা করে না,0
তোমার দাম কত? রেট,0
তোর খাওয়া দেখলেই তো ঘেন্যা লাগে,1
বোধহয় তোমার বোনের নাম ছিলো ছুটকি আর আধার কার্ডে নাম এসেছে পুটকি,0
তোরা বাড়া এইসব,0
আনফিলিংস বেডা মানুষ ,0
তুমি যেই ধন খাউ সেটাই ইয়াম্মি,0
একটু দুদু খেয়ে দেখি কেমন লাগে আনেক মজা ,0
মজুর বোতল টা একটু পুটকির ভিতরে ঢুকিয়ে দেখো কেমন লাগে বালের ভিডিও বানায়,1
আমার একটু মুত খেয়ে দেখ সেই ইয়ামি ইয়ামি ,1
ম্যাডাম তলটা একটু দেখাও,0
ধরে গোয়া মারমো,1
তোমাকে শুধু খাইতে মন চায়,0
বেবী নতুন মালটা কোথাই থেকে আমদানি করলে,0
আসো তোমাকেও দুর্বল করে দেবো তোমাদের ছেলেদের তো ২ মিনিটেই মাল বেরিয়ে যায়,0
"তোমার সমস্যা আছে ডক্টর দেখাও, ব্যাথা বানানোর ক্ষমতা তোমার নাই ",0
একটা লুচ্চা বান্ধবী লাগবে থাকলে ইনবক্সে নক দাও,0
এখনকার মেয়েরা সুদু ছেলেদের দেহ চায়,0
পাদের গন্ধ পারফিউম মনে হয়,0
সাওয়ার নিউজ ,1
লুচ্ছা সাংবাদিক,1
গাঁজাখোর মিডিয়া দীঘির বিয়ে হবে সেটাও একটা নিউজ,1
দিঘী এখন সাগরে পরিণত হয়েছে,0
হায়রে বাংলাদেশের হলুদ হাংবাদিক এউ সব চুলের খবর ও শিরোনাম হয়,0
"আর কোন নিউজ পাস না, কি করবি ব্লু ফিল্মের ভিডিও লাগাইয়া দে চুতিয়া নিউজ",1
টুনটুনিটি একেবারেই কেটে ফেলেছেরে বাবা।,0
তোগো আর কোন কাম নাই হেডার নিউজ এটা,1
একটা লুচ্চা বান্ধবী লাগবে থাকলে ইনবক্সে নক দাও,0
এইবার শাকিব ভাইয়া তার হারানো নুন্টুটা ফিরে পাবে জাতি আশা বাদি ,0
এমন সুন্দর বউ থাকলে নুনু থাকে না প্যান্টের নিচে ,1
এখন মন খাড়াইলেও ধন খাড়াইবার সুযোগ নাই।,1
বেইমান টুনটুনি পাখিটা উড়ে গেল ,0
নুনু খাইটা কি লাভ হইলো ,1
বোতা দা দিয়ে কাটলে ব্যাথা পাইবেন দেইখা ধারালো দা দিয়ে কেটে দিছে,0
নুনুর মাথা কি পাওয়া গেছে ,1
একন ত সোনা বন্ধুয়ে বোতা দা‌‌ দী ‌আসল সোনা কাটিয়া দীছে ,0
গানের সাথে অভিনয় করতে গিয়ে দোতা দা দিয়ে নুনু অর্ধেক করে ফেলছে ,1
পরী তো নয় যেন এক একটা ধান্দাবাজ ডাইনী,1
বোকাচোদা ছাত্রলীগ সব কয়টায় আসামি,1
বিশিষ্ট আদু ভাই তার মুখ থেকে অমর অমীয় বাণী জাতির উদ্দেশ্যে বলছেন ,0
কিন্তু জাতির তাতে বাল ছেড়া গেল ,1
নুনু,1
এই মহিলা বাটপার একে আইনের আওতায় আনা উচিত,1
আপনাকে অসংখ্য ধন্যবাদ লিঙ্গ কাটার জন্য,0
এই শালি একটা নষ্ট মহিলা এদের কে আইনের আলতা আনা উচিত,1
এই চুতমারানি বড়ই ডেঞ্জারাস ওরে আইনের আওতায় আনা হোক,1
এই মানুষগুলোকে উগান্ডা পাঠানো উচিত,0
তোমার এতো জলে কেন,0
ভবিষ্যতের সানি লিওন,0
যেভাবে হোক বাবা টাকা কামাইতে হইব। নির্লজ্জ,1
ওর বউকে মোদির কাছে পাঠানো হোক,0
এই মাল টা এসেছিলো আমাদের গ্রামে মেলাতে,0
"এই মেয়ে একজন নস্টা, মেয়ে, একে আইনের আওতায় আনা হোক।",1
ভাই দুই চারটা থাপ্পড় দিলে আরো বেশি ভালোই হতো,1
আরে ছালা পোঁদ মেরেছে ,1
হোগা মারা সারা ,1
তোদের নিউজ তোদের পিছনে ভইরা দিতে পারলে শান্তি পাইতাম ,1
গরু পাগলামি করে তাই নাম রেখেছে জায়েদ খান ,0
ইথে আরেক সুদানির পোয়া ,1
আস্তে আস্তে খেলবো রে সেই মজা হবে আসবো নাকি ,0
ওরে কেউ ভরে দেউ ,0
২ নাম্বার নোংরা মহিলা। হোল কাটার কতোদিন আগের ভিডিও এটা ,1
কি একটা অবস্থা পাগল ছাগলে দেশটা ভরে গেছে ,1
অশিক্ষিত মহিলা আর লোভী পুরুষ সবারই শাস্তি হওয়া দরকার।,1
শিখা দৌলদিয়া ঘাটের ঐ পাড়ার সর্দারনির মেয়ের মত লাগে।,0
মাল যে কিরাম বোজা হয়ে গেছে।,0
চুতমারানিরে গরম গরম ডিম দেওয়া হোক।,1
তোদের অত্যাচারে সামাজিক যোগাযোগ মাধ্যম আজ নিগৃহীত।,1
ভাই তোমাকে ধন্যবাদ কয়েকটা কুকুরের বাচ্চা,1
এই মহিলারে হাত পা বেঁধে জলন্ত আগুনে ফেলে দেয়া ধরকার,1
এই ছেমরি হলো ইবলিশ শয়তান শয়তানের রাজা,1
ফালতু মহিলা,1
দেশটা নোংরা হয়ে গেছে।,1
বারো বাতারি খারাপ মহিলা,1
নষ্টা মহিলা আচারন দেখলেই বোঝা যায়,1
হারামজাদারা এ ধরনের কি ধরনের ভিডিও,1
এই দেশে নারী নির্যাতনের বিচার হয় কিন্তু পুরুষ নির্যাতনের বিচার হয় না এজন্য ওনেক নষ্ট মহিলা এই সুযোগে বহু পুরুষের জীবন নষ্ট করতেছে!,1
সাকিব এর জীবন টা বরবাদ করে দিছে এই মহিলা,1
এই বাল দেখার জন্য এমবি কিনি নাই ,1
"ওরা উলঙ্গো হয়ে থাকবে তোর কি গার ফাটছে, যত সব আবাল নিউজ মারা",1
মাইয়া গুলা সামনে রাইখা মানসম্মান সব খেয়ে দিলি ভাই,0
অসুস্থ জাতি ,1
কুত্তায় কামড় দিছে নাকি,0
ছাগল কতগুলা ,0
মারা খাওয়ার লক্ষন,1
এরা সাহাউয়ার পদায়,1
নোংরা পরিবারের নোংরা প্রোডাক্ট,1
নোংরামি!,1
বস্তির রানী.,0
আমাগের বাংলাদেশের পাগলচোদা মাগিদের পাগলামি শুরু হয়ে গেছে খানকিমাগী দের মা বাপ নাই দেখেনা,1
খানকি মাগি,1
তোর গুষ্টি চুদি,1
বাঙ্গালী জাতী এদের কালছার কোন দিন ভালো হবে না,0
ছি ছি কি জঘন্য ,1
এদেরকে দিয়ে আসলে সংসার হয় নারাস্তার জিনিস রাস্তায় রাখা উচিত,1
দেশটা একেবারে শেষ,0
"কি শুরু হইল আবার, আবার বিচিতে আঘাত ",0
টাকা দিয়ে এম বি ভরে সামাজিক যোগাযোগ মাধ্যমে এইসব নষ্টামি আর এইরকম মানুষদের আকাম কুকাম দেখতে ইচ্ছে করে?,1
"চেহেরার নায় কোন ডক, আবার সব সময় কেমরাও ওপেন রাখে",1
ডাইনি মহিলা কোথায় থেকে এলো,1
এই মেয়েটা অনেক নোংরা,1
এই ধরনের চরিত্রহীন মহিলার সাথে কথা না বলাটাই ভালো,1
শিখা কিন্তু আপনাদের সমাজের একটা ভাইরাস মাগী ব্যবসায় জড়িত।,1
চেহারার মধ্যে বাসে দৌলোদিয়া পল্লীর মেয়ে। ,0
এসব টিকটকাদের আইনে আওতায় নেয়ার দরকার।,1
এই অভদ্র মহিলা লোভী চরিত্র হীন ,1
ফালতু মেয়ে শিখা,1
এই মহিলার উপর এখনো কেন জরুরী আইন ব্যবস্থা নেওয়া হয়নি,0
তিনি তো এখনো বাইরে স্বাধীনভাবে ঘুরতেচে ,0
এই ভিডিও তাহলে নুনু কাটার আগে ,1
ও ফকিন্নি রাস্তা এর খারাপ মাইয়া,1
শালী জহল্লাদের থেকে ও খারাপ ,1
মাগি মরদার আইডির কোন ভিডিও যেন ফেসবুকে না থাকে দয়া করে ফেসবুক কর্মকর্তাদের বলছি যেনো ডিলিট করে দিবেন,1
বোকাচোদা ছাগল পাগলের খেলা,1
এই জানোয়ার বাচ্চা টাকে দরে কঠিন বিচার করা হোক,1
"আমাদের দেশের আইন নেই, তাইতো এভাবে মেয়েগুলো কুকুরের মত চলাফেরা করে এবং কি ব্যবহার করে, ধিক্কার জানাই দেশের আইন কে ",1
অর বূদায় বাশ দিয়া করলে ঠিক হয়ে যেত কাংকি বেডি ,1
বিয়াদব একটা মেয়ে,1
একেই বলে কুত্তা ভাগ্য,0
তোরে কুত্তায়ও চোদবে না,1
তোগোরে ফাঁসিতে লটকাইয়া চুদমু,1
তোগোর ধোন টাইনা তোগো পিছন দিয়া ঢুকামু,1
তোর মায়ের ভোদা সিরিষ কাগজ দিয়া ঘইসা দিমু,1
তোর মায়ের ভোদায় বোম্বাই মরিচ দিয়া চুদমু,1
তোর বাপের পুটকির ভিতর দিয়া কাডল ঢুকামু,1
তোর ধোন দিয়া ডাংগুলি খেলমু,1
শালার পুতেগো অজুয়া শুরু হয়ে গেছে ,1
সুযোগ পেলে বিসিবির পিছন মারতে চাই,1
বান্ধীর পোলারা তোরাই নির্বাচক প্যানেলে কাজ কর,1
যে বালের খেলোয়াড় সাইফ,1
"ওটা তো ওর মম না, ঠাপানোর যন্র",0
পমপম হেব্বি ,1
ব্রা তুমি বড়ই মহান ঝুলে যাওয়া লাউকে দিয়েছো আপেল এর সম্মান।,0
মুখ না খুলে জামা কাপর খুলতে কন,0
বাইনচোদ,1
খানকির পোলা,1
মহিলাকে জনসিং এর কাছে পাঠিয়ে দেওয়া হোক,0
"দুঃখের বিষয় হলো,বাংলাদেশে লজ্জার ভ্যাকসিন পাওয়া যায় না!",0
"এইরকম বেয়াদব মেয়েদের কারনে দশটি মেয়েদের বদনাম, এইসব মেয়েকে চরম শিক্ষা দেওয়ার দরকার আমি হলে এখন কত খন চর মারলাম হয়, বেয়াদব মেয়ে, আমি একটা মেয়ে হয়ে বলছি একে মানে কি বলতাম ",1
বদমাইস বিটি। আর এখন তো পুরা ছেলেটার জীবন শেষ করে দিলো।,1
"এই বেডা সাংবাদিক গুলার লজ্জা শরম নাই, যেমন বেডি তেমন সাংবাদিক তেমনবেডির জামাই,সব খবিশ এক লগে",1
এই আবর্জনা গুলো সমাজের জন্য খুবই ভয়ংকর,1
এদের কে আইন আওতায় আনা হোক ,1
এটাতে কুত্তার কাচে নিয়ে জাও ভাই,0
ওকে দরে নিয়ে রাজ হাঁসের ডিম দেওয়া হক ,0
"শালার পোলা গো কাহিনী সারাজীবন থাকব, কি চলতে বাংলাদেশ ",0
দেশের সরকার কি এইসব দেখেনা এদের জন্য দেশটা নষ্ট হয়ে যাচ্ছে ,1
ফেসবুক টা রে ধর্ষণ করে ছেড়ে দিলে এরা।,1
এরে ডিম থেরাপি দেওয়া হোক,1
এদের জন্ম হয়েছে কনডম দুর্ঘটনায় এরা ভালো হবে কিভাবে।,1
এগুলোর গুষ্টির মারে ফোনটা হাতে লইলে এই ঘটনা সে ঘটনা।,1
সেই জন্যই তো টুনটুনি টা কেটে দেওয়া হয়েছে শিখা দারুন শিক্ষা দিয়েছে ,0
"টুনটুনি আর নুনটুনি খাইয়ে দিছো, এখন সেটা আবার খাওয়ানোর জন্য আইছে! পতনে পতন চিনেরে!",0
বল্টু কেটে ফেলে দিয়েছে কিন্তু এত তাড়াতাড়ি ভালো হয়ে গেছে,0
চুতমারানি মহিলা জাগার মাঝে লঙ্কা মরিচ দেওয়ার দরকার ,1
মহিলারা ধরে ওকে পিটাচ্ছে না কেন,1
ফুটন্ত গরম পানিতে চুবানো উচিৎ এই মেয়েকে,1
"এধরণের রেণ্ঢী মহিলা কে কাচের বোতল বেগে, জাইগা মতো দেয়া উচিত, তাদের জালা পেজবুক চালানো যাচ্ছেন, বেশরম, বেদব, কু বাচ্চা ফুট ফুটে সুন্দর ইউটুবাল",1
খানকির ছেলের সাথে খানকির মেয়ের ঝগড়া,1
করা শেষ সোনার বাংলাদেশ ,0
এই মহিলা আস্তা বড় বেয়াদপ।,1
পরে গেছিলা দেখেই আজ নুনু নাই,1
এই বেডিকে এখানো পুলিশে ধরেনি!,1
তুমি কে আমি কে রাজাকার রাজাকার,0
"যে নারীর লজ্জা নেই ভয় নেই, এ নারী না অন্য কিছু ভাবতেই অবাক লাগে ",1
যেরকম চেহারা আমার মনে হয় কুকুরও প্রসাব করবে না ওর মুখে। ,1
"এই মহিলা টা নারী নামক কলংক৷ আস্থা একটা বজ্জাত মহিলা,",1
এদের বোদার বিতরে বড় দেখে একটা কচু ডুকাই দেন,1
এই বেড়ির হুগার ভিতরে মরিচ ডলে লাগা ,1
ফেসবুকে একটা পাইছস বাপ দাদার কানকি মাগী আর খানকির পোলা যত কিছু আছে উল্টাপাল্টা ভিডিও চোদাও ,1
হালি একটা খানিক,1
এই নষ্টা মেয়ে শালী ,1
মহিলারে কুত্তার হাতে তুলে দাও,0
রাস্তায় রাস্তায় নষ্টামি শুরু করছে এই মহিলা,1
শিখা একটা নষ্টা মেয়ে চরিত্রহীন মেয়ে তার হাজবেন্ডের প্রসঙ্গ কেটে দিয়েছে,1
এই মহিলা বাবা খোর,0
ওর নুনু কি টিক হয়ে গেছে ,0
ওকে দৌলতদিয়া পোস্টিং করা হোক।,0
দয়া করে এসব ভিডিও ছারবেন না এসব বাল ছাল দেকতে আসিনা এফবি তে,1
এটারে দেখতে বেস্যার মত লাগে।,1
সাকিবের নাকি শোনা কাটছে তাহলে এটা কবের ভিডিও,0
পাগলের বাচ্চা নষ্ট মহিলা.,1
বস্তির মহিলা,1
তোগো পোন্দাপোন্দি অনলাইনে কে,1
আরে কি বলবো এই দেশে কোন আইন নেই যদি থাকতো তাহলে আজ এই জায়গায় বসে এগুলো দেখতে হতো না এই মেয়ে তো একটা নষ্ঠা মেয়ে এরে দেখলেই তো বোঝা যায় ,1
তোরা শালা হিজড়া নাকি মেয়েটার মাথার চুল খেটে দাও,1
এই মেয়েটাকে আইনের আওতায় এনে ডিম থেরাপি দেওয়া হোক,1
এদের জন্য সমাস নষ্ট এদের জন্য দেশ নষ্ট,1
গরম থেরাপি দেওয়া উচিত,1
এই মহিলার কথা ধরন খুব বাজেঘিন্না লাগে,1
এটা মহিলা নাকি হাইওয়ান৷।,0
শালী কুত্তার বাচ্চা,1
ভুসকি দিয়া মিডিয়া ভইরা গেছে,1
এ গুলো হল ডায়নী মহিলা,1
ওর পুটকি দিয়ে গরম ডিম দেয়া হক,1
জুনিয়া শাকিব নাকি সোনা কেটে দিয়েছে,0
হালকা করে চুদে দেন ওরে,1
"বিএনপির জন্য পুলিশ আছে, এদের জন্য কি কেউ নাই? আইনে আওতায় আনা হক",1
