Comments,HateSpeech
ভাইয়া আমাদের সমাজের মানুষ গুলো এমনই নিকৃষ্ট মাইন্ডের।,0
গরিব মানুষ এর সাতে এমন করা টা ঠিক না,0
আল্লাহর নিয়ামতকে আর কতভাবে নষ্ট করবেন!,0
আল্লাহ ব্যবসাকে হালাল করেছে আর এরা মরনের চিন্তাও করে না ,0
এর থেকে অপমান আর কি আছে,0
অনেক শাশুড়িদের কারণে সাজানো একটা জীবন নষ্ট হয়ে যায় এই কালাযাদু দিয়ে তেমনটাও আমার সাথে হইছে ,0
আমার ছোট্ট কলিজাটাকেও তারা ভুলভাল বুঝিয়ে আমার থেকে কেড়ে নিছে ,0
না ভাইয়া অনেক অনেক ভালো লেগেছে গল্পটা শুনে খুবই কষ্ট লেগেছে আমার,0
আহারে কিছু মানুষ শুধু সপ্ন দেখিয়ে কষ্ট আর ধোকা দিতেই জানে,0
বোন ডে তোমার কথা গুলো শুনে নিজের অজান্তেই চোখে জল এসে গেল. নারীদের সমমান এখনো অনেক পুরুষ আছে দিতে জানেনা,0
জি ভাই দুনিয়ায়তে থাকতে হলে অনেক কষ্ট সহ্য করতে হয়,0
আমার দু চোখের জল চলে এসেছে মানুষের জীবনে এত কষ্ট আপু তোমার কথা শুনে নিজেকে ধরে রাখতে পারছি না,0
পুরা ভিডিও টা দেখলাম বাট বলার ভাষা পাচ্ছি না,0
এই আপুর জীবন কাহিনী আর আমার জীবন কাহিনী মিলে গেল হায়রে কপাল ,0
অনেক কষ্ট লাগলো আপু দোয়া করি ইনশাআল্লাহ সবসময়ই ভালো থেক,0
আপু তোমার জীবন কাহিনী শুনে আমার চোখে পানি চলে এসেছে দোয়া করি তুমি অনেক সুখী থেকো,0
মনের অজান্তেই চোখে পানি চলে আসছে,0
আপু কথা গুলো শুনে চোখে পানি চলে আসলো,0
অনেক কষ্ট লাগলো কথাগুলো শুনে,0
আপু তোমার কথা শুনে চোখ দিয়ে পানি চলে আসছে আমার,0
আপু কথা গুলো শুনে কলিজা লাগছে ,0
মিথ্যা কথা কেউই ভালোবাসে না ,0
সত্যি কথা আপু কিছু শাশুড়ীর কারনে সাজানো সংসার নষ্ট হয় আমিও ডিভোর্সি আপু,0
"এই ঘটনা গুলো যার লাইফে ঘটে গেছে সেই জানে জীবন টা কত টা কঠিন, চোখের পানি ধরে রাখতে পারি নি কথা গুলো শুনার পর ",0
কিছু শাশুড়িদের জন্য অনেক মেয়ের লাইফটাই শেষ,0
আলহামদুলিল্লাহ আমার জীবনেও এমন আপু কিন্তু আমি এখনো কাউকেই পাইনি পাশে ,0
গল্প টা শুনে কান্না চলে আসছে,0
"আপু তোমার প্রথম কাহিনি শুনে, আমার কান্না চলে আসছে,",0
এভাবে যদি আমি একটু মন খুলে বলতে পারতাম তাহলে হয়তো একটু হালকা লাগতো ,0
ভিডিও টা দেখে চখের পানি ধরে রাখতে পারিনি  একটা ছেলে হয়ে,0
গল্প টা অনেক সুন্দর কিন্তু অনেক কষ্ট,0
আসলে খুব একটি দুঃখজনক বিষয় বাচ্চাটার জন্য দোয়া রইল আল্লাহ যেন উনাকে সুস্থ করেন এই দোয়াই করি,0
ইতিহাস সাক্ষী কেমেরা মেন কখোনো সাহায্য করে না,0
যে মেয়ের মা যত চালাক সেই মেয়ের তাড়াতাড়ি হয় তালাক,0
এই পৃথিবীতে এখন আর কেউ কাউকে ভালোবেসে না শুধু প্রয়োজনে ব্যবহার করে ,0
হাইরে পূথিবীর কিছু মানুষ কেউ কাদেছে একটু ভালোবাসার জন্য আর কেউ এতো ভালোবাসা পেয়েও টাকার লোভে থাকে,0
মেয়েটার বারির লোক ছিলো লোভি টাকার তাই এরকম করলো ছেলেটার সাথে,0
নারী স্মানেরা উপযুক্ত কিন্তু বিশ্বাসের নয়,0
আমার জীবন ও এমনি হয়েছে তবুও আমি আমার বউকে অনেক ভালো বাসি তাকে ছাড়া থাকতে খুব কষ্ট হয়,0
মানুষ বড়ই বেঈমান সেটা ছেলে হোক বা মেয়ে হোক ,0
আল্লাহ এই ছেলেটার পুরো জীবন নষ্ট করে দিলো মেয়েটা,0
"হায়রে মেয়েরা, কেন তরা এমন করিস,",0
ওর কপালে দুঃখ আছে ইনশাআল্লাহ ,0
এতগুলো মানুষ জীবন দিয়েছে এটা খুবই দুঃখ জনক কথা,0
একটা ছেলে চাইলে সময় ও দিতে পারে মুখে না বলে অবহেলা ও করতে পারে ,0
"আমিও একজন কে এই ভাবেই সময় দিতাম কিন্তু সে বুঝে নাই,ছেড়ে চলে গেছে",0
মানুষ মায়ায় পড়ে নিজেকে ধ্বংস করার জন্য!,0
আহারে কত কষ্ট রে মানুষের কষ্ট দেখলে আমারও কষ্ট লাগে ,0
"আমার কেউ নেই, কেউ ছিলো না, এই অনুভূতি টা বড্ড বাজে।",0
খুব দুঃখ জনক আল্লাহ সকলকে হেফাজত করুন,0
"চোখের পানি সবার জন্য আসে না, আর যার জন্য আসে সে তার মূল্য বুঝে না!",0
"হুট করে অসহায় লাগার ব্যাপারটা, সত্যিই শ্বাসরুদ্ধকর।",0
শখের মানুষের কথা ভেবে কান্না করে দেওয়া মানুষটা জানে ভালোবাসা কতটা ভয়ংকর!,0
"জানতাম না, এতো তাড়া তাড়ি তোমাকে হারিয়ে ফেলবো। তবু এ টুকু চাওয়া তুমি মানুষ টা ভালো থাকো।",0
তুমিও আমার মতো ছেকা খাইছো ,0
তারে অনেক খুজি তবে আর পেলাম না,0
"কিছু মন খারাপের কোনো ব্যাখ্যা হয় না, শুধু নিঃশ্বাস নিতে কষ্ট হয়!",0
এর যে কান্না দেখতেছিস না. বিশ্বাস কর ভাই সব মিথ্যা  এর থেকেও ভয়ানক কান্না করেও সালিরা ছাড়ি যায় ,0
"হৃদয় খুলে দেখি আর কোনো দুঃখ নেই, বরফের মতো সব জমে জমে শোক হয়ে গেছে!",0
একটা মানুষ তিলে তিলে শেষ হওয়ার পিছনে একটা মানুষের মায়াই যথেষ্ট!,0
সবাই সত্যিকারের ভালোবাসার মর্যাদা বুঝে না।,0
ভালোবাসা কেন এত অসহায় ,0
সৌন্দর্যের সম্পর্ক চাহিদা পর্যন্ত,0
আর মায়ার সম্পর্ক মৃত্যু পর্যন্ত,0
থাকতে কেউ মূল্য দেয় না হারায় গেলে সবাই খোঁজ,0
কিছু করার নাই যে যাওয়ার সে হাজারবার ছেড়ে যাবে? ,0
সর্বোচ্চ চেষ্টা করার পরেও দেখলাম আমি নিজেই অপরাধী ,0
আচ্ছা ছেলেদের জন্য মেয়েরাও কান্না করে ,0
"আপু এমন একটা মেয়ে আছে যে কি না পরিবারের দোহায় দিয়ে আমাদের রিলেশন টা নষ্ট করছে,",0
কে রে ভাই এত কস্ট দিলে আপু টারে,0
যে দুঃখ দেয় তাকে জড়িয়ে ধরে কাঁদতে মন চায়,0
ভালোবাসা কঠিন জিনিস ভয়ংকর তার মায়া,0
কতটা কষ্ট নিয়ে নিয়ে চাপা-কান্না কাদে,0
"তেমন কাউকে পেলাম না, এমন অনুভূতি আসবে। হাইরে জীবন",0
মানুষ কেনো ঠকায় মানুষ কে ,0
এই ভাবে মন থেকে চাওয়া ভালোবাসা গুলো পূর্ণতা পায় না ,0
আচ্ছা তোমার কষ্টটা কেউ তো বুঝতাছে না,0
আপু কতোজনের জন্য কান্না করে,0
আমি এই বোকা ছিলাম.তার অবহেলা যে ছেড়ে যাওয়ার প্রথম ধাপ ছিল আমি বুঝতেই পারি নাই,0
আমি কখনো কাউকে ব্যবহার করিনি,0
আর ভবিষ্যতেও করবো না,0
তাই কেউ কখনো আমার হবে না ,0
নিজের ধ্বংসের দিকে তাকিয়ে মুচকি হাসি দিয়ে ফিরে আসা অদ্ভুত মানুষ আমি।,0
"কেঁদে আর পেলাম কই, তাই না হয় মুক্তি দিলাম",0
ভালোবাসা বলতে কিছু হয় না সব ড্রামা ,0
কলিজা ফুটা করা একটা গান ,0
ঘৃণা করি আমি সেই ভালোবাসা কে,0
অবহেলায় তো লোহাতেও মরিচা ধরে! আমরা তো মানুষ মাএ!,0
আমি ঘৃণা করি সেই ভালবাসাকে যে ভালোবাসা হাজারো ছেলে-মেয়েকে জীবন্ত লাশ বানিয়ে দে,0
কেদে কেদে চোখের পানি শেষ ,0
ভালোবাসা মানেই তুমি কষ্ট পাবে হয় আজ না হয় কাল,0
আমি এখন সত্যি মন থেকে ঘৃণা করি ভালোবাসাকে,0
আমিও ঘৃণা করি ভালবাসাকে,0
সে তো আছে অন্যের সাথে সুখি আর আমি আছি তার দেয়া কষ্ট নিয়ে সুখি ,0
বুজি না কিছু গান টা শুনলে কষ্ট কেনো হয় আমার,0
হারানোর কষ্ট সেই পাই জার হাড়াই,0
হৃদয় ক্ষত বিক্ষত হবে.,0
তবুও কিছু মানুষের স্মৃতি অক্ষত হয়ে থেকে যাবে.,0
ঘৃণা করি আমি ওই সব ভালোবাসা নামক কথা গুলো কে ,0
মুল্যহীন জায়গা থেকে নিজেকে সরিয়ে নেওয়ায় ভালো ,0
ভালোবাসা প্রকাশ করলে মানুষ হারিয়ে যায়,0
"কেঁদে আর পেলাম কই,তাই হাসি মুখে মুক্তি দিয়ে দিলাম",0
কষ্ট হলেও মুক্তি দিয়ে শান্তি,0
আমার গল্পের প্রতিটি পাতায় শুধু শূন্যতার ছায়া,0
কেঁদে আর সুখ পাইলাম কই। হেঁসে না হয় দুঃখকে আপন করে নিলাম।,0
"তাকে না পাওয়ার যে অপূর্ণতা বুকের মধ্যে, তা পৃথিবীর কোনো কিছুর বিনিময়ে পূর্ণ হওয়ার নয়",0
ড্রামা দেখতে দেখতে প্রেম না করেও চেখা খাচ্ছি,0
"যে থাকতে চাই না, তাকে মুক্তি দেওয়ায় ভালো",0
এটা একটা গান নয়। এটা হাজারো ব্যর্থ প্রেমিকের বুকফাটা কান্নার আওয়াজ,0
কথায় আছে সুখে থাকতে ভুতে খেলা,0
আল্লাহর দেওয়া চেহারা বাদ দিয়ে যারা এমন করছে আল্লাহ পাক তাদের হেদায়েত দান করুন আমিন,0
নতুন পেলে পুরান বিষাক্ত হয়ে যায় এইটায় নিয়ম,0
শুধুমাত্র রাগ আর ইগোর কারণেই একটা মানুষের জীবন থেকে সব আস্তে আস্তে ধ্বংস হয়ে যায়।,0
আমার কাছে রাগ আর ইগোর চেয়ে অনুভূতির মূল্য অনেক বেশি। কিন্তু মানুষ সেটা কে সস্তা মনে করে।,0
"অনূভুতি প্রকাশ করলে, অন্য দিক থেকে অবহেলা শুরু হয়ে যায়।",0
"বিচ্ছেদের দুনিয়ায় ভালোবাসার মূল্য নেই, মানুষ এখন অপশনের খোঁজে থাকে ",0
"উচিত কথা। এখন মানুষের কাছে মানুষের কোন মূল্য নেই। মায়া, আন্তরিকতা, ভালোবাসা এখন অর্থহীন একটা শব্দ মাত্র। আল্লাহ মালিক।",0
"যত্ন করে সবকিছু রাখা গেলেও মানুষকে রাখা যায় না, অথচ আমরা বোকা মানুষ, যারা থাকতে চায় না তাদেরকে আগলে রাখতে চাই!",0
"জেদি আর রাগী মানুষ নিজেও শান্তি পায়না, কাউকে শান্তিতে রাখতেও পারেনা। এরা অভিসপ্ত।",0
"ঠিক বলেছেন,ভালোবাসার কোনো সম্মান নেই।",0
আমার প্রিয় মানুষটি আমাকে রেখে না ফেরার দেশে চিরো বিদায় নিয়েছে ,0
সে ‘আমাকে’ অসুখ ছাড়া “রোগী” বানিয়ে দিয়েছে!,0
কষ্টের শহর,0
"তোমারে পাইয়াও কেনো পাইলাম না, এই কথাটা এসে বার বার আ-ঘাত করে!",0
" হাজার ওওও যুদ্ধ করে, তাকে পাওয়া হলো না,",0
"পেয়েও হারিয়ে ফেলেছি,আমি এক অভাগী",0
"চাইলেই সব হতো, কিন্তু সে তো চেয়েছে অন্য কাউকে",0
এক তরফা ভালবাসা চাওয়া বেদনাদায়ক ,0
মানুষটা আমার খুব সখের ছিল; শুধু আমি তার যোগ্য ছিলাম না!,0
সখের মানুষ পাওয়া হয়ে গেলে সখ শেষ হয়ে যায় ,0
"সত্যিই, তুমি চাইলেই সব হতো, কিন্তু তুমিই চাইলে না।",0
আমি চাইছিলাম তুমি অহংকার দেখাইছো,0
আমি না হয় ভুল করচি। কিন্তু তুমি আমাকে ঠোকিয়েছো ,0
ভাগ্য আমাকে বিষাক্ত পরিস্থিতি ছাড়া আর কিছুই দিল না।,0
"ইথারে মিলিয়ে যায় বস্তুগত সূর্য, ভাবগত প্রেম অথবা জীবন! ",0
বেশি ভালোবাসলে মানুষ হারিয়ে যায়!,0
"বিশ্বাস করো, যাকে তুমি মন থেকে ভালোবাসবে, দেখবে সে নিজ থেকেই চলে গেছে,",0
ভালোবাসা প্রকাশ না করে সেই মানুষ টি হারিয়ে যায়। আবার ভালোবাসা প্রকাশ করলে তার কাছে সস্তা হয়ে যায় ,0
এতটা ভালোবাসার পরও মানুষটাকে ধরে রাখতে পারি নাই ,0
"ভালোবাসা কম প্রকাশ করলেও মানুষ হারিয়ে যায়,",0
"হারিয়ে যায় না, বেইমান হয়ে যায় ",0
আমি খুব করেই চিল্লাইয়া ফাল্লাইয়া কান্না করতাম,0
কিছু মানুষের অভাব সারা জীবন থেকে যাবে ,0
"বিনা কারণে যারা জীবনে দুঃখের গল্প তৈরি করেছে! তাদের অভিশাপ দিতে হবেনা, তাঁদের জন্য একসময় ""নীরবতাই"" যথেষ্ট হবে।",0
তারা ছেড়ে ও যাই আবার দোষ ও দিয়ে যাই।,0
"আমার সাথেও এমন হয়ছে, সব দোষ আমাকেই দিয়ে গেলো",0
"নিজের ভয়ংকর অতীতটা যতবার খুঁটিয়ে দেখি, ততবার মনে হয়; এটাকে যদি জীবন থেকে মুছে ফেলতে পারতাম!",0
"সবার জীবনে এমন কিছু আঘাত, কষ্ট থাকে যা প্রকাশ করা যাই না।",0
এই একজনরে দেখলাম বউ এর কোলে কান্না করতেছে তাও আবার এক্সের জন্য,0
কত দিন মনের ইচ্ছা মতো শব্দ করে কাদি না।চিতকার করে কান্না করলে একটু শান্তি পাইতাম,0
"এই গানটার মাঝে অনেক কষ্ট, মায়া লুকিয়ে আছে",0
কান্নাটা আমরা গোপনই করি প্রকাশ্যে আসলেও মুখ লুকায়.,0
"হারাইতে হারাইতে যুগ পাড়ি দিলাম, এখন আর কোনো কিছু হারাইলে দুঃখ হয় না",0
ভুলতে পারি নি ছেড়ে যাওয়া মানুষ টা কে ,0
রোজ যাকে কাঁদতে সেকি কি আর নতুন করে দুঃখ চিনে,0
"এমন কেউ নাই, তাই এমন সুখ আসা করা টাও বোকামি",0
কেনো ছেড়ে যায় তার খোঁজ কি কেউ নেয় ,0
পায়ে ধরেও কিছু কিছু মানুষ কে ধরে রাখা যায় না,0
সবাইকে ভালোবাসা যায় না আর যাকে ভালোবাসা হয় সে ভাগ্যে থাকে না ,0
আমি ও এমন করে কাদছি তার বুকে থাকতে চাইলাম কিন্তু সেই আমাকে দূর দূর করে তারাই দিতেছে অন্য নারী জন্য,0
আমি এই দুনিয়ার পতেকটা মানুষ কে ঘৃণা করি,0
"সত্যিই, বড্ড অসহাস একটা বাক্য.",0
যে যাওয়ার তাকে এই বাক্য বললেও সে চলে যাবে,0
পায়ে ধরে ভিক্ষা চাইছি তাকে সে আমাকে ভিক্ষুক ভেবে ফিরিয়ে দিয়েছে,0
এক আকাশ পরিমান ভালোবাসার নামই ছেরে যাওয়া,0
সত্যি এটা অসহায় বাক্য পৃথিবীতে নেই? ,0
আমার চোখের পানি এতো সস্তা তোমাকে ভালো না বাসলে বুঝতাম না,0
পায়ে ধরে কান্না করেও ধরে রাখতে পারি নাই,0
আমাকে ছেড়ে যেও নাএটা বোধহয় পৃথিবীর সবথেকে অসহায় বাক্য!,0
"সে পেয়ে গেছে তার নতুন মানুষ, আমার হয়নি কেউ!",0
এইটা সবাই বোঝেনা বুঝলে কেউ কাউকে ছেড়ে যেত না,0
"ইস রে ভাই তোরে তো তাও কেউ জরে ধরেছিলো, আমার দিকে দেখ কেউ জরেই ধরলো না আজ পর্যন্ত,",0
মানুষ মায়ায় পড়ে নিজেকে ধ্বংস করার জন্যে,0
পুরুষ তুমি প্রতিষ্ঠিত না হয়ে কাউকে ভালোবাসা অপরাধ!,0
কেউ কেউ চায় না আবার কেউ চেয়েও পায় না,0
হয়তো একদিন আমিও তোমার জন্য এমন পাগল হয়ে জাব প্রিয়,0
নাটকটা দেখে খুব কষ্ট পাইছি।,0
এটাই বাস্তব ভাইয়া থাকতে কেও মুল‍্য দেয়না,0
অনেক ভালোবাসি তাকে কিন্তু সে তা বুঝে না,0
এত কিছু করার পরও তাকে আমার করে রাখতে পারি নি ,0
"কত কাঁদছি,তার একটা মেসেজ আসলে সব কাজ ছেড়ে ছুড়ে তাকে সময় দিতাম তার কাছেই আমার কোন গুরুত্ব নেই।",0
সত্যিকারের ভালোবাসা হলো আবেগ এবং অনুভূতিতে ভরা কিন্তু এখন এটারে কেউ মূল্য দেই না।,0
অনেক ভালোবাসার পরও সে আর আমার নেই ,0
"যে থাকতেও বুঝে না, সে, হারিয়ে গেলে কী করে বুঝবে।",0
"এই শাসন করা মানুষ গুলোই ঠকে যাই, আর তাদের এই শাসন কে আবেগ বলে তাদের কেই ছেড়ে ছলে যাই,",0
আপনি যাকে বেশি ভালোবাসবেন সে আপনাকে কখনো বুঝবে না,0
