Comments,HateSpeech
শাহবাগী উন্নয়ন অ্যাসোসিয়েশন (শাউঅ্যা),1
যত সব নষ্টা মেয়ে,1
যে পোস্ট টা করলো সে কেমন মানুষ সেটা আগে ভাবেন ,0
এই মেয়ের কাহিনীটা কেউ বলবেন? ,0
উপরে রসে টইটম্বুর ভিতরে মিয়া খলিফা,0
আপনারা দুই-একদিনের মধ্যে এগুলো কিভাবে বের করেন ,0
এইডা তো বস্তি রে ভাই ,1
কেমনে কি?,0
গন্ধ,0
ওরে রিমান্ডে দিন,0
কেমরা মেন কনট্রল করলো কিভাবে,0
"লোক লজ্জার ভয়ে বলতে পারিনা, এই ডিস্টিং ডিস্টিং আগুন আমার পছন্দ হইছে",0
ভাই এই মেয়েটাকে সাপুড়ের মেয়েদের মত লাগতেছে,0
তাইলে কি এইটারও লিংক আছে ,0
আমার ক্রাশ টা. অপপ্স ,0
নিচু মনের মানুষ আপনারা,1
এরা কি লেবু পিনিক,0
"খারাফ বলে তো, ব্যাবহার এমন",1
দৌলতদিয়া ঘাটের স্বাবলম্বী নারী,0
এই আইডি রিপোর্ট মারেন এরা দেশের শত্রু ভারতের দাদাল,1
"কি মেয়েরে, বাবা",0
ঠাশ চরটা মিস হই গেলো৷ মনে মনে ইমাজিন করে নিলাম,0
শাহবাগী উন্নয়ন অ্যাসোসিয়েশন (শাউঅ্যা) এর সহ-সভাপতি,1
নোংরা মানসিকতার মেধাবী ,1
একজন নটির কথায় সেনাবাহিনী চলে না।,1
কুত্তার বাচ্চা ফুটফুটে সুন্দর ,1
মেয়ে টা তো দেখছি চরম বেয়াদব আমি ত ভালো মনে করে ছিলাম,1
এই মেয়ে একটা বেয়াদব,1
পতিতার সাথে কথা না বলাই ভালো,1
মেয়েটি কথার ভাব দেখলে বুজা যায়,0
"সে একটা বেয়াদব,",1
এই মেয়ে তলে উপরে মেধাবী এবং হিরোইন্সি।,1
এই মেয়েটাকে দেখলে আমার বমি আছে,1
আমি মনে করি ওনি পাগল ছাড়া আর কিছু নয়‍,1
আমার দেখা সেরা অশিক্ষিত মেয়ে,1
শাহাবাগি গুলারে দেখলেই বমি আসে ,1
"শাহাবাগী গুলা যে দেশের কেন্সার এইটারে দেখলেই বুঝা যায়,",0
তার মুখের ভাষা অনেক খারপ,1
"প্রতিবাদী আর বেয়াদবী দুটো আলাদা বিষয়, বেডি ভালো হইয়া যা না হয় থাপ্পড় খাবি",1
"অসভ্য, বর্বর আস্ত একটা বেডি.",1
"কতটা নির্লজ্জ বেহায়া, কি তার এটিচিউড এবং শব্দ চয়ন। ঘেন্না লাগছে, ছিঃ ",1
"মেয়েটা সেনাবাহিনীসাথে খুব খারাপ ব্যাবহার করেছে,",0
এই মেয়ের দেখলেই আগে মুখে গালি আসতেছে,0
আরে এতো ঝগড়া কেমনে করে মানুষ ,0
"শিক্ষিত বেয়াদব, ভাইরাস হওয়ার এমন করছে।",1
বেচারা শেষ ,0
যে ওরে পাবে ওর জীবনডা ত্যানা ত্যানা ,0
হাজার বেড়ার সাথে রাত কাটানো মেয়ের ব্যবহার এর থেকে ভালো আর কি হবে।,1
ভাই গানটারে এভাবে অপমান না করলেও পারতি ,0
মাইয়া এটা নেশা করে।,0
এরা এখন অসভ্যতামি করছি প্রত্যেকটা মানুষের সাথে,1
অল্প বয়সে পাকলে বাল দুঃখ থাকবে চিরকাল,1
পরোটাই নষ্টামি এটা কোন মেয়ে হলো,1
গানজাখোর মহিলা,0
কোন খানকির অভ্যুত্থান আবার দেশে ,1
এসব রাতের মেয়েদের কেন দিনে ছাড়া হয় বুঝিনা।,0
মেয়াদ উর্ত্তীর্ণ গাঁজার প্রভাব। অভদ্র মেয়ে।,1
একটি বেয়াদব মহিলা না কি বেয়াদব মেয়ে।,1
ডিম থেরাপি খাইতে চায় মনে হয়,0
সেনাবাহিনী এই মাইয়ারছে বোকাচোদা হয়ে গেছে।,1
ফালতু মহিলা ,1
শাহবাগি উন্নয়ন বোর্ডের (শাউয়া রানী),1
মুখের মধ্যে সেই আর্মিটা ঢুকে যাবে ,0
মুখের ভাষা শুনলে মনে হয়,0
দৌলোদিয়া ঘাটের নেতৃত্বে ছিলেন,0
শিক্ষিত সমাজের ধর্ষন ঘটিয়েছে এই মহিলা শাহবাগীরা কইরে ,1
নোংরা ,0
এই বেডি বেয়াদব,1
সে তো বোকাচোদা না তার কপালে কি লেখা আছে সেই বোকাচোদা,1
"কয়দিন আগে তো আব্বা বলছো, এখন খালু বল",0
দু্দ দেখাই সালাম দিতেছোস কেন আহারে খনিকের মেয়ে ,1
আপু এর চাইতে আপনার উলঙ্গ ছবি আপলোড দিতেন,1
নির্লজ্জ বেহায়া প্রিয় তুমি,1
যেই নগ্ন শরীর দেখাইতেছেন আল্লাহ হেদায়েত দান করুক,1
বাংলার মিয়া খলিফা রেট কত একটু জানাবেন,0
তর ভোদার ভিতরে কি চুলকানি বেশি নাকি সালি,1
"চুতমারানি, দেশের অবস্থা খারাপ আর তুই ভিডিও দেস",1
মাদার চোদ খাংকিরে,1
ওকে দেখেই বোঝা যাচ্ছে ১০০ পিস ইয়াবা খেয়েছে,0
দেখেই বোঝা যায় এইটা বস্তির মেয়ে।,1
তোর বাপ মা জন্মের সময় তোরে লজ্জাপতি পাতা দিয়া চোখ বুলায় নাই,0
ওর পেটে কুকুরের বাচ্চা আছে। বসার স্টাইল দেখছেন।,0
জামাইডারে তো আস্তা একটা মগার মত লাগে ভাদাইমা,1
ডাইনি কটকটি আপা চুরন্নি আপা,1
দুটোই লোকের খাওয়া মাল,0
"কুত্তার ৩৪ নাম্বার বাচ্চা, এরা ভাই বোন,",1
বেডিরে বুড়ি বুড়ি লাগতাছে,1
গাড়ি সাদা হলেও টায়ার কিন্তু কালো প্রমাণিত,0
যারা লাভ দিছে তারাও মনে হয় তানিশার কোয়ালিটির,0
নাজিম তানিশারে দিয়া বন্ধুদের সাথে গ্যাংব্যাং করাবে,0
তানিসার তাকানো দেখলে বোঝা যায় ওও কতটা খার,0
আসলেই মীম রাজরানি আর তানিশা চাকরানি,1
ভাই এদের ভিডিও দিবেন না এরা হলো নির্লজ্জ বেহায়া,1
এই চ্যাট দেখার জন্য ফেসবুক চালাই ,1
পৃথিবীতে সেই সবথেকে সুখি ব্যাক্তি যার কোনো লজ্জা শরম নাই,1
এত মানুষ মরে এরা মরতে পারে না,1
অন্যের জামাই নিয়ে কত বড় বড় কথা লজ্জা লাগেনা মহিলার ছি ছি.,1
শালীর বেটির টাকা পয়সার অভাব নাই তাহলে অনলাইনে আসে কেনও খানকি মাগি,1
অকে সবাই আনফলো করে দেওয়া উচিত,0
চরিত্রহীন তানিসা তোমার ফ্যামিলির চরিত্র দোষ আছে,1
চোরের মায়ের বড় গলা,1
লজ্জা শরম না থাকলে যায় হয় আর কি,0
নাজিমের দোকান বয়কট,0
তানিশার মত মেয়ে যেখানে পা রাখবে ধ্বংস হয়ে যাবে,1
যেমন কর্ম তেমন ফল,0
বেয়াদব মহিলা,1
অতি চালাকের গলায় দড়ি,0
"আপনি ও একটা বিয়াদব, নতুন নাটক করতে শুরু করছে",1
গেলো রে গেলো তোর ভাতার।,0
আপু খুব টায়ার্ড একজন সতীন হলে ভালো হতো ,0
অন্যের জামাই নিয়া টানাটানি করা যার নেশা,0
চোর পাল্লারের জিনিস পএ চুরি করে চুন্নি,1
তোকে কাজের বেডি কাজের বেডি লাগতেছে ,0
ন্যাকামি ছাড়া আর কিছুই লাগে না,0
লাজ লজ্জা না থাকলে যা হয়,1
আগেরজন আছিল রাজরানী! কিন্তু এইডা দেহি চুতমারানি,1
এদের এতো ব্লক করি তারপর ও এই দুই জাতীয় নির্লজ্জ আমার নিউজ ফিডে ,1
পৃথিবীতে যে সব মানুষের লাজ লজ্জা বলতে কিছু নাই তারা সুখী মানুষ,0
আফার যায়গা মতো হাত দিছে,0
ওর গালি শুনে আমার রেগুলার গালির কথা ভুলে গেছি ,0
মাইয়া দেখি গালির উপর ডিগ্রি করে আসছে,0
বুড়া মানুষ মানুষের চোদনা,1
হালার পুরা মাথা নষ্ট ,1
"যে পোষ্ট করেছে তার মনে মা নাই, রাস্তায় জন্ম,",1
পাডা কোন ভাষা জ্ঞান নেই,0
তোর অমানুষের বাচ্চ,1
গরুর দুধের কথা বলছেন উনি ,0
আক্কল যেরকম এরকমই তো বলব,0
পরির চুলকানি উঠছে,0
দুইটার লজ্জা বলতে নাই,1
আমি ত ভয়ে আছি ককন জানি জামা খুলে জায় ,1
পরি মনি সাইজ মেপে দেখাচ্ছে তোর থেকে আমারটা বড়,0
নাউজুবিল্লাহ হে আল্লাহ ওদেরকে হেদায়েত দান করুক আমিন,0
বস্তির মেয়ে তোর কি লজ্জা সরম নাই,1
"কাক কখনোই ময়ুর হতে পারেনা, মনে রাখিস।",0
তুই একটা লাইফলেস ছিলি যার কারণে অন্যের সংসার নিলি বেয়াদব ,1
"নাজিম মিম এর পা চেটে খায়,",1
দেখ তোর আসল চেহারা,0
কিরে তোর কি লজ্জা নাই,1
ডাইনির মতো,1
তর জন্য কে দোয়া করে ফালতু মেয়ে,1
পাবলিকরে না দেখাইলে ভাল্লাগে না এতো শখ যখন জামা খুইল্লা আইতি,0
কতটা নির্লজ্জ বেহায়া,1
"মানুষ কত বেশি পাপ করলে, পুরো দেশবাসী একযোগে গালা’গালি করে ভাবা যায়",0
হেতে তুর জামাই হইলো কেমনি মাগিরবাচ্চা। এটা তুর দুলাভাই,1
নাজিমের চাচি তোর সব কিছু ফাঁস করে দিছে শাক চুন্নি পরকীয়া রাজা রানী,1
সোনা বন্ধু তুই আমারে গুতা দাও কাইটলা,0
"বেশি পাইকা গেছে, এতো ছেলেকে পাকাইন না",0
দেশটা নষ্টামিতে ভরে গেছে,1
"বেশ, ষাড় বেটা রা",1
মেয়ে যেভাবে পড়ছে তাতে হাত ঐখানেতো অজান্তেই চলে যাবে।,0
বেলুন ধরে কেমন মজা পেলে গো? ,0
"আমি পারি না আর পারি না, আমি কেন মরি না",0
ফাতরামির একটা লিমিট থাকা দরকার।,1
দুদ টা ধরার মজাই আলাদা,0
চোপ একদম চোপ কতা কম ,0
এএএ চুপ একদম চোপ ,0
"কোনও ফতুয়া কাজ হবে না, বয়কট,",0
নাটক দেখাই যাবে না বয়কট,1
তোদের নাটক আর দেখবো না,0
বয়কট অব্যাহত রাখুন সবাই,0
"যুব সমাজ নষ্টের কারিগর, গালি দিয়ে ভরপুর সব নাটক, বয়কট চলছে",1
এরা টাকার জন্য ঘরের বউ বিক্রি করে দিবে বাটপার।,1
বয়কট বয়কট বয়কট বয়কট ,0
তোর মায়রে খালি করি আজ থেকে তোগো নাটক দেখবো না ,1
আর হবে না দেখা রে বন্ধু আর হবে না দেখা,0
আইনের চোখ অন্ধ ,0
মারছে বেডা গাড়িতে বেডি বুঝলাম না,0
জি ভাই বাংলাদেশে সবই সম্ভব,0
স্বামী অপরাধ করেছে স্ত্রী কে ধরে নিয়ে যাচ্ছে,0
বাংলাদেশে আসামির এতোই অভাব,0
এখানে ন্যায়ের সাথে অন্যায় করা হচ্ছে ,1
এইটা বিরোধী দলীয় ষড়যন্ত্র ,0
গরুর হোগা দুই রকম,0
বড় হয়ে পাক্কা দালাল হবে,1
অল্প বয়সে পাক্কালে যা হয় আরকি ,1
এতো পাকন্নামি করে গুরু নেওয়া যাবেনা,0
শালা একটা বাটপার,1
বাপ বেটা কি বোকা চুদা নাকি ,1
এমন বাল পাকনা ছেলে আপনি জন্ম কিভাবে দিলেন,1
অল্প বয়সে পাকিলে বাল দুঃখ থাকবে চিরকাল!,1
বেপারির মাথার পুটকি মেরে দিছে বাল পাকনা পিচ্চি,1
বাল পাখনা ছেলে,1
অল্প বয়সে বাল পাকলে যা হয়,1
এদের ঘার ধাক্কা দিয়ে বের করে দেয় না ক্যান মাদারচুদ,1
"কোরবানি নিয়ে এত নাটক করা ঠিক নয়,",0
বেশি বাল পাক না,1
"এসব ভাইরাল হওয়ার জন্য কুরবানি করার জন্য নয়, যতো সব ফালতু",1
খানকি মাগি লজ্জা নাই,1
মনে হয় আওয়ামিলীগ আমলে সুদ আর ধর্ষণ হয় নাই! ভাবখানা এমন?,1
পরকীয়া তো হাসু আপাও করছে,1
গণভবনে যে কনডমের প্যাকেটটা পাওয়া গেছে সেটা কে ব্যবহার করত জাতি জানতে চায়। ,0
আফসোস লীগ সন্ত্রাসী গুষ্টি ,1
অভিনয়ে কোটায় চাকরি পাওয়া পদপ্রার্থী ,0
নানার যৌবনে ডাক দিছে।,0
বাচ্চার গায়ের কাপড় টা ও কি বের হয়ছে,0
আহো ভাতিজা খেলা হবে ,0
মিডেল ফিংগার ও মাই গড,0
পম পম পম দুটো,1
"বিনতে, যেখানে পাবেন চুষে দেবেন।",0
আমি অনেক বার ধরছি এই ভাবে ওই ভাবে।,0
আমার ওজন বেশি হয়ে গেছে।রিক্স নিতে চাচ্ছি না,0
এরা মেধাবী রাতে মেধা ডুকাচ্ছে,0
কি হচ্ছে সমাজের ,0
এই মাদরচোদকে খুজে বাহির করে শাস্তি দেওয়া হোক৷,1
এই মাদরচোদকে খুজে বাহির করে শাস্তি দেওয়া হোক৷,1
নৈতিকতা কোথায় ,1
নেতার রাইতের ডিনার ,0
এই আইডিটার পুটকি লাল করতে হবে,1
অথচ চিত হয়ে শুয়ে থাকাটা ছাত্রলীগের নেত্রী ,0
উনি মানুষ হিসেবে বিশ্ব বেহায়া এবং জাতীয় পা চাটা দলের সদস্য।,1
এমনটা হলে ঋতুপর্নাকেও বয়কট করতে হবে,0
মানসিকতা কোথায় ,1
এদেরকে বিচারের আওতায় আনা দরকার,0
শত শত খুনের সাক্ষী ও হুকুম দাতা এই ডাকাত।,1
উনার কোন দোষ নাই দোষ লাল পানির,0
বিবেক কোথায় ,1
নির্লজ্জ বেহাযা।,1
চুপ থাক বেয়াদব ,1
"চুপ থাক, বেয়াদপ কোথাকার। কেক বানানো ভুলিয়ে দেব",1
"মুখ বন্ধ কর বিয়াদব কোথাকার,",1
এই মেয়ে তুমি এত বেয়াদব কেন,1
চুপ করো,0
চাচার ভবিষ্যৎ উজ্জ্বল কামনা করি বড় হয়ে যেনো স্টেজ কাপাতে পারে,0
শত্রুরও যেন এমন বউ না হয়.,0
পাদিতে গিয়া দিলাম হাগিয়া. আই লাভ ইউ সাদিয়া ,0
মাইকেল জ্যাকসন হতে চেয়েছিলো পরিবারের চাপে চোর হয়ে গেছে,1
পরিক্ষা না নিয়ে যদি বিয়ের জন্য চাপ দিত।,0
আমি এই মেয়ের ভবিষ্যৎ জামাইয়ের আত্মার মাগফেরাত কামনা করছি।,0
মেয়েটা ভাবে চিল্লাইলেই মার্কেট পাওয়া যাবে ,0
"গুড়া কৃমি মনে হয় একটু বেশি বড় হয়ে গেছে,",0
হাহা আমি পারিনা আর পারিনা আমি কেন মরি না,0
জনি ভাই তাড়াতাড়ি করেন ওর মুখে বের করে দেন. পানি,0
ভালো হয়ে যাও মাসুদ তোমাকে আমি অনেক সময় দিয়েছি বাণীতে: কাউয়া কাদের ,1
"চারিদিকে শুধু দুষ্টু কোকিল ডাকছে, এবার ঠিক আছে কুওা ডাকছে ঘেউ ঘেউ ঘেউ।",0
ছিঃ ছিঃ আমার ধারণা এতটাই খারাপ আগে জানতাম না,0
বাইন্সোদ,1
চোরের মায়ের বড় গলা ,1
"নিজেকে থেকে দাম বাড়িয়ে বোকার পরিচয় দিচ্ছে, ",1
"পাগল, এরে কেউ গাঞ্জা খাওয়া",0
"চুদির পু দোকানদার কে, গরুর বিচি খাও",1
সব আবাল,1
এতো গুলা ষাড়ের মধ্যে আপনে কি গাই ,0
নিজেই নিজের মানসম্মান খাইয়া দিছে,0
শালা গো যন্ত্রণা জীবন মোর তেনা তেনা হইয়া গেলে,1
আপনার ফ্যানদের ভেতর দেখি অধিকাংশই গরু-ছাগল,1
"খানকির পোলারা নিজেরা আগে কিছু বানিয়ে দেখা,তার পর বয়কট চুদা",1
ফেসবুক হোয়াটসঅ্যাপ ইনস্টাগ্রাম বয়কট করে দেখা,0
বয়কট কোক ও মোজো নো দালালি,0
"দরকার পড়লে মদ খা, তাও কোকাকোলা খাইস না।",0
মিমিরে চাকরানির মত দেখা যায়,1
পাপ বুজি কমতি ছিল বাংলাদেশ এ।,0
বুড়ি দিয়ে তুফানের বাড়োটা বাজাইছে,0
মিমি যেই ভাবে ড্রেস ধরছে মনে হয় ওর পেটে বাচ্চা আছে। ,0
মিমির চেহারা নষ্ট হয়ে গেছে,0
"সাকিব বলো রুমে ডাকবে, সাবধান,",0
মিমি প্রেগন্যান্ট নাকি,0
আচ্ছা এরা এগুলা কি পরে কেমন লাগে দেখতে,1
"পড়ছেটা কি এটা, মানুষের রুচি এত নিম্নমানের",1
মিমির ঠোঁটের কি অবস্থা মনে হয় বুড়ি,0
শাকিবের বাপের ডাকে এসেছে।,0
"মিমি তোকে বাজেলাগে, এই ডেরেসে",0
কিন্তূ ও এরকম চোরের মতো উকি মারছে ক্যান,0
এই দেশে এত পাগল আছে?,0
মিমির পেট কেমন যেন বড় বড় মনে হচ্ছে? ,0
একজন পুরুষ এর জিবন ধ্বংশের জন্য একজন অযোগ্য নারীই যথেষ্ট,1
আসো খেলবো ,0
আমি তো খেতেই থাকি ,0
"মেধাবী ছাত্র, শরীরের রক্তের অনেক তেজ।",0
এটা আবার কি বিড়িও খাই দেখি।,0
"বেবি কাম ডাউন, কাম ডাউন.",0
এঝশামক্সহবক্সিস্কনাব্ব্বজবস ও লক ডাউন ও লক ডাউন ,0
আর চিনতা নাই নিজের পতি কনফিডেন্স ফিরে পাইছি।,0
দুদ হিলা ছাড়া কি জানিস।,0
ফকিন্নি শাকিব নকল করছে এনিমেলের লোক। ফালতু ক্যারেক্টরের বাচ্চা,1
